agency_cd	site_no	station_nm	site_tp_cd	dec_lat_va	dec_long_va	coord_acy_cd	dec_coord_datum_cd	alt_va	alt_acy_va	alt_datum_cd	huc_cd
5s	15s	50s	7s	16s	16s	1s	10s	8s	3s	10s	16s
USGS	02339210	WEHADKEE CREEK NEAR PITTMAN AL	ST	33.22511878	-85.3199473	U	NAD83				03130002
USGS	02339215	WEHADKEE CREEK NEAR ROCK MILLS AL	ST	33.14734284	-85.2818902	U	NAD83				03130002
USGS	02339225	WEHADKEE CREEK BELOW ROCK MILLS, AL	ST	33.1223435	-85.2491113	U	NAD83	 647.21	.01	NGVD29	03130002
USGS	02339430	KELLEM HILL CREEK AT LAFAYETTE, ALA	ST	32.88179348	-85.39105889	U	NAD83				03130002
USGS	02339455	ALLEN CREEK NR LAFAYETTE, ALA	ST	32.9109594	-85.36605829	U	NAD83				03130002
USGS	02339480	OSELIGEE CREEK AT COUNTY RD 92 NEAR FREDONIA, AL	ST	32.92305556	-85.2994444	S	NAD83				03130002
USGS	02339493	OSONIPPO CREEK BELOW FAIRFAX, ALA	ST	32.7662422	-85.1671623	U	NAD83				03130002
USGS	02339495	OSELIGEE CREEK NEAR LANETT AL	ST	32.9015159	-85.1963308	S	NAD83				03130002
USGS	02339550	CHATTAHOOCHEE R (LANETT INTAKE) AT LANETT, AL	ST	32.86346154	-85.1843857	S	NAD83	 0	  1	NGVD29	03130002
USGS	02339780	CHATTAHOOCHEE RIVER AT LANGDALE, AL	ST	32.8140186	-85.1674404	S	NAD83	 540.01	.01	NGVD29	03130002
USGS	02340750	OSANIPPA CREEK NEAR FAIRFAX AL	ST	32.7890192	-85.1916077	U	NAD83				03130002
USGS	02340770	OSANIPPA CREEK NEAR BLANTON, AL.	ST	32.7323545	-85.1413279	U	NAD83				03130002
USGS	02340900	HALAWAKEE CREEK NEAR OPELIKA AL	ST	32.6970772	-85.2668874	U	NAD83				03130002
USGS	02341030	WACOOCHEE CREEK (NEAR PHENIX CITY)AT VALLEY AL	ST	32.62235836	-85.1332713	U	NAD83				03130002
USGS	02341480	MILL CREEK NEAR PHENIX CITY AL	ST	32.49236396	-85.0327111	U	NAD83				03130003
USGS	02342115	UCHEE CREEK NEAR HUGLEY, AL.	ST	32.3862547	-85.2354955	U	NAD83				03130003
USGS	02342125	UCHEE CREEK NR CRAWFORD, ALA	ST	32.3784777	-85.1816045	U	NAD83				03130003
USGS	02342150	UCHEE CREEK NEAR SEALE AL	ST	32.35459047	-85.09549	U	NAD83	 275.00	.01	NGVD29	03130003
USGS	02342180	UCHEE CREEK NEAR SEALE, AL.	ST	32.35125745	-85.0721557	U	NAD83				03130003
USGS	02342200	PHELPS CREEK NEAR OPELIKA AL	ST	32.563748	-85.2766093	U	NAD83	 530.00	.01	NGVD29	03130003
USGS	02342280	LITTLE UCHEE CREEK NEAR BLEECKER, AL	ST	32.4959734	-85.1707719	U	NAD83				03130003
USGS	02342360	LITTLE UCHEE CREEK NEAR CRAWFORD AL	ST	32.46180845	-85.13077	U	NAD83				03130003
USGS	02342400	LITTLE UCHEE CREEK NEAR SEALE, AL.	ST	32.37792309	-85.0804896	U	NAD83				03130003
USGS	02342500	UCHEE CREEK NEAR FORT MITCHELL, AL.	ST	32.31681467	-85.014931	S	NAD83	 201.76	.01	NGVD29	03130003
USGS	02342540	UCHEE CREEK AT FT BENNING, ALA	ST	32.2954267	-84.977152	U	NAD83				03130003
USGS	02342870	HIGH LOG CREEK (SITE A) NR HATCHECHUBBEE, AL	ST	32.27264757	-85.2993852	S	NAD83	 305	 10	NGVD29	03130003
USGS	02342871	HIGH LOG CREEK (SITE B) NR HATCHECHUBBEE, ALA	ST	32.2723698	-85.2993852	S	NAD83	 305	 10	NGVD29	03130003
USGS	02342890	HATCHECHUBBEE CR AT COUNTY ROAD NR PITTSVIEW, ALA	ST	32.1820961	-85.1668797	U	NAD83				03130003
USGS	02342892	HATCHECHUBBEE CREEK AT US 431 NR PITTSVIEW, AL	ST	32.18265164	-85.1674352	U	NAD83				03130003
USGS	02342897	WATERMELON CREEK NEAR PITTSVIEW AL	ST	32.2434829	-85.166047	U	NAD83				03130003
USGS	02342899	WATERMELON CREEK AT PITTSVIEW AL	ST	32.19376246	-85.1463235	U	NAD83				03130003
USGS	02342902	HATCHECHUBBEE CREEK AT COTTONTON, ALA	ST	32.14015329	-85.0727093	U	NAD83				03130003
USGS	02342910	NORTH FORK COWIKEE CREEK NEAR HURTSBORO AL	ST	32.192095	-85.3068843	U	NAD83				03130003
USGS	02342912	HURTSBORO CREEK AT HURTSBORO, ALA	ST	32.23681478	-85.4152214	U	NAD83				03130003
USGS	02342913	HURTSBORO CREEK BELOW HURTSBORO, ALA	ST	32.20570509	-85.3793866	U	NAD83				03130003
USGS	02342915	HURTSBORO CREEK NEAR HURTSBORO AL	ST	32.18126194	-85.3268848	U	NAD83				03130003
USGS	02342920	NORTH FORK COWIKEE CREEK NEAR GLENVILLE AL	ST	32.0901548	-85.2093799	U	NAD83	 210	 10	NGVD29	03130003
USGS	02342925	MIDDLE FORK COWIKEE CREEK NEAR HURTSBORO AL	ST	32.17126195	-85.3779972	U	NAD83				03130003
USGS	02342928	MIDDLE FORK COWIKEE C NR HAWKINSVILLE, AL.	ST	32.05710047	-85.2288245	U	NAD83				03130003
USGS	02342930	BRONSON C NR CLAYTON, ALA	ST	31.96987999	-85.4404965	U	NAD83				03130003
USGS	02342933	SOUTH FORK COWIKEE CREEK NEAR BATESVILLE AL	ST	32.0176572	-85.2957704	S	NAD83	 200.00	10.	NGVD29	03130003
USGS	02342935	UNNAMED TRIB TO SO FORK COWIKEE CR NR BATESVILLE	ST	32.0382121	-85.2768813	U	NAD83				03130003
USGS	02342937	South Fork Cowikee Creek nr Howe, AL	ST	32.0167861	-85.2138	1	NAD83	196	1.6	NAVD88	03130003
USGS	02342940	COWIKEE CREEK NEAR EUFAULA AL	ST	31.9821026	-85.1149314	U	NAD83				03130003
USGS	02342965	CHEWALLA CREEK NEAR EUFAULA AL	ST	31.93821505	-85.178822	U	NAD83				03130003
USGS	02342969	CHEWALLA C AT EUFAULA, ALA	ST	31.9071046	-85.1490988	U	NAD83				03130003
USGS	0234296950	CHATTAHOOCHEE R AT EUFALUA, ALA	ST	31.8915494	-85.1338205	U	NAD83				03130003
USGS	02342980	BARBOUR C NR WHITE OAK, ALA	ST	31.8987715	-85.3404932	U	NAD83				03130003
USGS	02342985	LEAK C NR WHITE OAK, ALA	ST	31.93071503	-85.3432712	U	NAD83				03130003
USGS	02342987	UNNAMED TRIB TO LEAK C NR WHITE OAK, ALA	ST	31.93071519	-85.3110481	U	NAD83				03130003
USGS	02342990	DOWDY C NR LUGO, ALA	ST	31.9334931	-85.2677136	U	NAD83				03130003
USGS	02342995	BARBOUR CREEK NEAR OSCO, AL.	ST	31.8957163	-85.2335458	U	NAD83				03130003
USGS	02342997	Barbour Creek at Barbour Lane nr Eufaula, AL	ST	31.8883861	-85.1947667	1	NAD83	198	1.6	NAVD88	03130003
USGS	02343000	BARBOUR CREEK NEAR EUFAULA AL	ST	31.86321687	-85.1610435	U	NAD83	 143.07	.01	NGVD29	03130003
USGS	02343040	CHENEYHATCHEE CREEK NEAR EUFAULA AL	ST	31.84043987	-85.2196563	U	NAD83				03130003
USGS	02343050	WHITE OAK C NR BAKERHILL, ALA	ST	31.7698861	-85.2227117	U	NAD83				03130003
USGS	023432415	CHATTAHOOCHEE R .36 MI DS WFG DAM NR FT GAINES, GA	ST	31.62138889	-85.06	S	NAD83	0.01	.23	NAVD88	03130004
USGS	02343275	ABBIE CREEK NEAR ABBEVILLE AL	ST	31.5618355	-85.2049324	U	NAD83				03130004
USGS	02343276	VAN MILL CREEK AT ABBIEVILLE, ALA	ST	31.56905749	-85.23104429	U	NAD83				03130004
USGS	02343277	ABBIE CREEK BELOW ABBIEVILLE, ALA	ST	31.53322508	-85.2110436	U	NAD83				03130004
USGS	02343278	SKIPPERS CREEK AT ABBIEVILLE, ALA	ST	31.5557243	-85.26465609	U	NAD83				03130004
USGS	02343280	ABBIE CREEK NR TUMBLETON, ALA	ST	31.478504	-85.2377107	U	NAD83				03130004
USGS	02343292	SANDY CREEK NEAR NEWVILLE AL	ST	31.43711596	-85.2599332	U	NAD83				03130004
USGS	02343298	ABBIE CREEK NR BROWNS CROSSROADS, ALA	ST	31.4562825	-85.2096544	U	NAD83				03130004
USGS	02343300	ABBIE CREEK NEAR HALEBURG AL	ST	31.47350458	-85.162431	U	NAD83	 145.74	.01	NGVD29	03130004
USGS	02343370	ABBIE CREEK BELOW HALEBURG, ALA	ST	31.41128437	-85.097985	U	NAD83				03130004
USGS	02343400	FOSTER CREEK AT STATE HIGHWAY 95 NEAR HALEBURG, AL	ST	31.36073004	-85.1110409	U	NAD83				03130004
USGS	02343500	CHATTAHOOCHEE RIVER AT COLUMBIA, AL.	ST	31.2840655	-85.0957629	S	NAD83	 72.23	.01	NGVD29	03130004
USGS	02343590	OMUSSEE CREEK NR DOTHAN, ALA	ST	31.2748967	-85.3627111	U	NAD83				03130004
USGS	02343595	POPLAR SPRING BRANCH AT JUDSON ST IN DOTHAN AL	ST	31.21462058	-85.3721554	U	NAD83	 297.00	.01	NGVD29	03130004
USGS	02343600	OMUSSEE CREEK NR KINSEY, ALA	ST	31.291008	-85.2965995	U	NAD83				03130004
USGS	02343700	STEVENSON CREEK NEAR HEADLAND AL	ST	31.35517405	-85.1846536	U	NAD83	 150.39	.01	NGVD29	03130004
USGS	02343710	OMUSEE CREEK NEAR HALEBURG	ST	31.34211888	-85.1771534	U	NAD83				03130004
USGS	02343750	OMUSEE CREEK AT COLUMBIA, AL	ST	31.28350978	-85.1165966	S	NAD83				03130004
USGS	02343802	CHATTAHOOCHEE RIVER BELOW ANDREWS L&D	ST	31.2582327	-85.1102076	U	NAD83				03130004
USGS	02343830	CHATTAHOOCHEE RIVER @ FARLEY NUCLEAR PL (WITHDRAW)	ST	31.22240045	-85.1082632	U	NAD83				03130004
USGS	02343831	CHATTAHOOCHEE RI AT FARLEY NUCLEAR PLANT (RELEASE)	ST	31.22212268	-85.1082632	U	NAD83				03130004
USGS	02343848	CEDAR CREEK AT EAST COOK ROAD NR PANSEY, AL.	ST	31.18545678	-85.1499306	S	NAD83				03130004
USGS	02343850	CEDAR CREEK AT ST HWY 95 NEAR CALUMET, ALA	ST	31.18962357	-85.118819	S	NAD83				03130004
USGS	02344000	CHATTAHOOCHEE RIVER AT ALAGA, ALA	ST	31.11657069	-85.0471513	S	NAD83	 62.72	.01	NGVD29	03130004
USGS	02344025	BRYANS CREEK AT STATE HWY 95 NEAR CROSBY, ALA	ST	31.0696276	-85.0449292	S	NAD83				03130004
USGS	02347425	YELLOW RIVER AT BABBIE, ALA	ST	31.27378106	-86.3485645	U	NAD83				03140103
USGS	02358755	LIMESTONE CREEK ON STATE HWY 109 BELOW DOTHAN, A	ST	31.0990682	-85.4204888	U	NAD83				03130012
USGS	02358765	BIG CREEK AT STATE HIGHWAY 203 NEAR REHOBETH, AL	ST	31.08045758	-85.4313222	S	NAD83				03130012
USGS	02358770	BIG CREEK NEAR MADRID AL	ST	31.02073814	-85.3502106	U	NAD83				03130012
USGS	02358775	BUCK CREEK AT COTTONWOOD, ALA	ST	31.04907095	-85.3140993	U	NAD83				03130012
USGS	0235878055	COWARTS CREEK NEAR LOVE HILL, ALABAMA	ST	31.1224021	-85.2921548	1	NAD83				03130012
USGS	0235878075	COWARTS CREEK ABOVE COTTONWOOD, AL.	ST	31.1054586	-85.25465459	U	NAD83				03130012
USGS	02358785	COWARTS CREEK AT SR 53 NR COTTONWOOD, AL.	ST	31.0168506	-85.222432	U	NAD83				03130012
USGS	02359970	UNNAMED TRIB TO LINDSEY C BELOW CLAYTON, ALA	ST	31.8223846	-85.4427176	U	NAD83				03140201
USGS	02359972	UNNAMED TRIB TO LINDSEY CR NR CLAYTON, AL	ST	31.82044023	-85.4463288	U	NAD83				03140201
USGS	02359975	LINDSEY CREEK NEAR CLAYTON AL	ST	31.78905234	-85.4366061	U	NAD83				03140201
USGS	02359980	LINDSEY C NR LINDSEY, ALA	ST	31.7523868	-85.4488283	U	NAD83				03140201
USGS	02360000	WEST FORK CHOCTAWHATCHEE R AT BLUE SPRINGS AL	ST	31.66377696	-85.5049396	U	NAD83	 289.24	.01	NGVD29	03140201
USGS	02360002	BLUE SPRING AT BLUE SPRINGS, ALA	ST	31.66155475	-85.5071618	U	NAD83				03140201
USGS	02360275	JUDY CREEK NEAR OZARK AL	ST	31.4632243	-85.5721595	U	NAD83				03140201
USGS	02360280	JUDY CREEK EAST OF OZARK AL	ST	31.44433588	-85.5654925	S	NAD83				03140201
USGS	02360290	WEST FORK OF CHOCTAWHATCHEE RIVER NR OZARK, ALA	ST	31.41128117	-85.5352141	U	NAD83				03140201
USGS	02360300	EAST FORK CHOCTAWHATCHEE RIVER NEAR EDWIN AL	ST	31.67738818	-85.3457697	U	NAD83				03140201
USGS	02360400	EAST FORK CHOCTAWHATCHEE RIVER NR CAPPS, ALA	ST	31.49433594	-85.3682685	U	NAD83				03140201
USGS	02360495	BLACKWOOD CREEK NR HEADLAND, ALA	ST	31.38100504	-85.3974346	U	NAD83				03140201
USGS	02360500	EAST FORK CHOCTAWHATCHEE R NEAR MIDLAND CITY AL	ST	31.37322677	-85.47715769	U	NAD83	 179.10	.01	NGVD29	03140201
USGS	02361000	CHOCTAWHATCHEE RIVER NEAR NEWTON, AL.	ST	31.3429492	-85.6104912	U	NAD83	 138.56	.01	NGVD29	03140201
USGS	02361020	HURRICANE CREEK NR OZARK, ALA	ST	31.41572526	-85.6366035	U	NAD83				03140201
USGS	02361023	HURRICANE CREEK ABOVE NEWTON, ALA	ST	31.3632265	-85.6157693	U	NAD83				03140201
USGS	02361025	HURRICANE CREEK NR NEWTON, ALA	ST	31.3479491	-85.6141023	U	NAD83				03140201
USGS	02361030	FAKE SITE FOR FORT RUCKER BLANKS, DUP, ETC SAMPLES	ST	31.3498934	-85.6554914	U	NAD83				03140201
USGS	02361036	TR TO BROOKINGS MILL TR (FT RUCKER HANCHEY REFUEL)	ST	31.34906009	-85.6549358	U	NAD83				03140201
USGS	02361038	TR TO BROOKINGS MILL TR (FORT RUCKER LANDFILL)	ST	31.33128266	-85.6766022	U	NAD83				03140201
USGS	02361044	TR TO BROOKINGS ML CR TR AT FORT RUCKER (MOTORPOOL	ST	31.33322698	-85.7063245	U	NAD83				03140201
USGS	02361045	TR TO BROOKINGS ML CR TR NR DALEVILLE (RECYCLING)	ST	31.32822709	-85.7077133	U	NAD83				03140201
USGS	02361046	TR TO BROOKINGS ML CR TR NR DALEVILLE (O-STORAGE)	ST	31.32517164	-85.6968799	U	NAD83				03140201
USGS	02361048	UN TRIB TO CHOCTAHA RIV AT FORT RUCKER (PAINT SHED	ST	31.3212828	-85.7018798	U	NAD83				03140201
USGS	02361071	LITTLE CHOCTAWHATCHEE RIVER ABOVE DOTHAN, ALA	ST	31.26350743	-85.4399339	U	NAD83				03140201
USGS	02361074	MURPHY MILL BRANCH NR DOTHAN, ALA	ST	31.27906245	-85.4604898	U	NAD83				03140201
USGS	02361093	TRIB BEAVER C AT ROSS CLARK CIRCLE IN DOTHAN AL	ST	31.2023983	-85.4185446	U	NAD83	 302.00	.01	NGVD29	03140201
USGS	02361100	BEAVER CREEK NEAR DOTHAN AL	ST	31.2382298	-85.5018786	U	NAD83				03140201
USGS	02361105	BEAVER CREEK NR DOTHAN, ALA	ST	31.21489778	-85.4352114	U	NAD83				03140201
USGS	02361130	LITTLE CHOCTAWHATCHEE RIVER NR PICKARD, ALA	ST	31.25239599	-85.5296564	U	NAD83				03140201
USGS	02361150	LITTLE CHOCTAWHATCHEE RIVER NEAR DOTHAN AL	ST	31.27433968	-85.6196567	U	NAD83				03140201
USGS	02361175	LITTLE CHOCTAWHATCHEE RIVER NEAR WICKSBURG AL	ST	31.23628509	-85.61965629	U	NAD83				03140201
USGS	02361236	PINE LOG CREEK NR SLOCOMB, ALA	ST	31.09156725	-85.5927113	U	NAD83				03140201
USGS	02361238	PINE LOG CREEK BELOW SLOCOMB, ALA	ST	31.082123	-85.6102112	U	NAD83				03140201
USGS	02361250	HURRICANE CREEK NEAR HARTFORD AL	ST	31.1065667	-85.6196557	U	NAD83				03140201
USGS	02361253	DOWLING BRANCH NR HARTFORD, ALA	ST	31.1285102	-85.6963224	U	NAD83				03140201
USGS	02361255	HURRICANE CREEK NR BELLWOOD, ALA	ST	31.17184228	-85.6988226	U	NAD83				03140201
USGS	02361350	BEAR CREEK NEAR OZARK AL	ST	31.4448911	-85.703271	U	NAD83				03140201
USGS	02361365	UNNAMED TRIB. TO HARRAND CREEK AT ENTERPRISE, AL	ST	31.32739285	-85.8385492	U	NAD83				03140201
USGS	02361368	TR TO HARRAND CR AT FORT RUCKER (AIRCR MAIN @ LOWE	ST	31.35239307	-85.7529917	U	NAD83				03140201
USGS	02361370	HARRAND CREEK AT FORT RUCKER, AL.	ST	31.33822676	-85.7485469	U	NAD83	 25.00	.01	NGVD29	03140201
USGS	02361373	COWPEN CREEK NEAR LEVEL PLAINS, AL.	ST	31.31739358	-85.7849364	U	NAD83				03140201
USGS	02361375	CLAYBANK CREEK NEAR DALEVILLE AL	ST	31.30822746	-85.7432685	U	NAD83				03140201
USGS	02361400	CLAYBANK CREEK AT CLAYHATCHEE AL	ST	31.2346181	-85.7382673	U	NAD83				03140201
USGS	02361500	CHOCTAWHATCHEE RIVER NEAR BELLWOOD AL	ST	31.15934229	-85.7843789	S	NAD83				03140201
USGS	02362000	CHOCTAWHATCHEE RIVER NEAR GENEVA, ALABAMA	ST	31.0412902	-85.8521574	S	NAD83	 62.80	 .1	NGVD29	03140201
USGS	02362175	BLANKET CREEK NR ENTERPRISE, ALA	ST	31.29267099	-85.8929945	U	NAD83				03140201
USGS	02362200	DOUBLE BRIDGES CREEK NEAR ENTERPRISE AL	ST	31.2832266	-85.9154949	U	NAD83				03140201
USGS	02362240	LITTLE DOUBLE BRIDGES CREEK NR ENTERPRISE, AL.	ST	31.27239318	-85.9582737	U	NAD83	 195.00	.01	NGVD29	03140201
USGS	02362245	LITTLE DOUBLE BRIDGES CR NR BATTENS CROSSROADS,	ST	31.25489369	-85.9518843	U	NAD83				03140201
USGS	02362340	DOUBLE BRIDGES CREEK NEAR ENTERPRISE, AL.	ST	31.21350619	-85.9577173	U	NAD83				03140201
USGS	02362500	DOUBLE BRIDGES CREEK AT GENEVA AL	ST	31.04267904	-85.8613243	U	NAD83				03140201
USGS	02362590	JOHNSON CREEK NEAR MIDWAY AL	ST	32.0684868	-85.5388336	U	NAD83				03140202
USGS	02362610	PEA RIVER NEAR MIDWAY, AL.	ST	32.05015387	-85.5724452	U	NAD83				03140202
USGS	02362638	INDIAN CREEK AT PICKETT AL	ST	31.97987809	-85.624112	U	NAD83				03140202
USGS	02362640	PEA RIVER NEAR PEROTE AL	ST	31.9454348	-85.6205004	U	NAD83				03140202
USGS	02362700	PEA CREEK NEAR CLAYTON AL	ST	31.89238234	-85.4646632	U	NAD83				03140202
USGS	02362740	PEA C ABOVE LOUISVILLE, ALA	ST	31.81905059	-85.5688313	U	NAD83				03140202
USGS	02362745	HURRICANE CREEK NEAR CLAYTON AL	ST	31.905992	-85.5852215	U	NAD83				03140202
USGS	02362750	PEA CREEK NEAR LOUISVILLE AL	ST	31.79655043	-85.6527214	U	NAD83				03140202
USGS	02362775	BUCKHORN CREEK NEAR JOSIE AL	ST	31.81904868	-85.7491122	U	NAD83				03140202
USGS	02362780	BUCKHORN CREEK NR SHILOH, ALA	ST	31.77738367	-85.7185555	U	NAD83				03140202
USGS	02362790	PEA RIVER NEAR BRUNDIDGE AL	ST	31.71405208	-85.7071653	U	NAD83				03140202
USGS	02362795	UNNAMED TRIB TO BIG C BELOW CLIO, ALA	ST	31.7259887	-87.6330515	U	NAD83				03140202
USGS	02362800	THOMPSON CREEK (BRANCH CREEK) NEAR CLIO AL	ST	31.70960817	-85.6607757	U	NAD83				03140202
USGS	02362810	BIG CREEK NEAR CLIO AL	ST	31.71127456	-85.6866094	U	NAD83				03140202
USGS	02362850	RICHLAND CREEK NEAR BRUNDIDGE AL	ST	31.72544056	-85.724388	U	NAD83				03140202
USGS	02362900	BOWDEN MILL CREEK NEAR BRUNDIDGE AL	ST	31.6690521	-85.7829991	U	NAD83				03140202
USGS	02363000	PEA RIVER NEAR ARITON AL	ST	31.59488716	-85.7829975	U	NAD83	 246.72	.01	NGVD29	03140202
USGS	02363005	PEA RIVER TRIBUTARY NEAR ROETON, AL.	ST	31.59599786	-85.8099427	U	NAD83				03140202
USGS	02363053	PEA RIVER NEAR ENTERPRISE, AL.	ST	31.4726663	-85.9041093	U	NAD83				03140201
USGS	02363055	MOORES BRANCH NEAR VICTORIA AL	ST	31.46322218	-85.899109	U	NAD83				03140202
USGS	02363100	PEA RIVER NEAR ELBA AL	ST	31.43294439	-85.9696659	U	NAD83				03140202
USGS	02363195	WHITEWATER CREEK ABOVE BRUNDIDGE, ALA	ST	31.74432679	-85.8616139	U	NAD83				03140202
USGS	02363200	WHITEWATER CREEK NEAR BRUNDIDGE AL	ST	31.72877145	-85.871336	U	NAD83				03140202
USGS	02363225	TRIBUTARY TO WALNUT CREEK NEAR TROY	ST	31.78876865	-85.94495	S	NAD83	 400	 10	NGVD29	03140301
USGS	02363230	WALNUT CREEK NR TROY, ALA	ST	31.77265828	-85.9243938	U	NAD83				03140202
USGS	02363240	WALNUT CREEK AT CO. RD. 63, NR. TROY, AL.	ST	31.72849274	-85.9249486	U	NAD83				03140202
USGS	02363260	WHITEWATER CREEK NEAR TARENTUM, AL.	ST	31.63655074	-85.9227243	U	NAD83				03140202
USGS	02363270	MIMS CREEK NR BRUNDIDGE, ALA	ST	33.68204698	-85.8705219	U	NAD83				03140202
USGS	02363280	WHITEWATER CREEK NR TARENTUM, ALA	ST	31.63655074	-85.9227243	U	NAD83				03140202
USGS	02363300	WHITEWATER CREEK NEAR ARCUS AL	ST	31.50571976	-86.0316136	U	NAD83				03140202
USGS	02363330	BIG CREEK NR SPRING HILL, ALA	ST	31.67821516	-85.994116	U	NAD83				03140202
USGS	02363375	BIG CREEK NR JACK, ALA	ST	31.5412742	-86.0527262	U	NAD83				03140202
USGS	02363400	BIG CREEK NEAR ARCUS AL	ST	31.4887757	-86.0530029	U	NAD83				03140202
USGS	02363500	WHITEWATER CREEK AT ELBA AL	ST	31.41516645	-86.0621685	U	NAD83				03140202
USGS	02363550	WHITEWATER CREEK AT MOUTH AT ELBA, ALA	ST	31.4154442	-86.0621686	U	NAD83				03140202
USGS	02364000	PEA RIVER AT ELBA, AL.	ST	31.4134998	-86.0630019	U	NAD83	 159.24	.01	NGVD29	03140202
USGS	02364050	BEAVERDAM CREEK AT STATE HWY 203 AT ELBA, AL	ST	31.42238837	-86.085225	S	NAD83				03140202
USGS	02364200	PEA RIVER AT ALBERTON, ALA	ST	31.2743363	-86.1155014	U	NAD83				03140202
USGS	02364400	CRIPPLE CREEK NEAR OPP, AL	ST	31.25378058	-86.199393	U	NAD83				03140202
USGS	02364500	PEA RIVER NEAR SAMSON AL	ST	31.11267588	-86.0993868	U	NAD83	 97.95	.01	NGVD29	03140202
USGS	02364570	PANTHER CREEK NEAR HACODA AL	ST	31.12100846	-86.1868896	U	NAD83	 140.00	.01	NGVD29	03140202
USGS	02364700	FLAT CREEK NEAR SAMSON AL	ST	31.04351198	-86.10133	U	NAD83				03140202
USGS	02364800	PEA RIVER AT ALA HWY 87 NR SAMSON, ALA	ST	30.99712508	-85.9960488	U	NAD83				03140202
USGS	02364885	SANDY CREEK NR SAMSON, ALA	ST	31.08378838	-86.0391067	U	NAD83				03140202
USGS	02364900	SANDY CREEK NEAR GENEVA AL	ST	31.0362903	-85.9663264	U	NAD83				03140202
USGS	02365000	PEA RIVER NEAR GENEVA AL	ST	31.02712398	-85.8838246	U	NAD83				03140202
USGS	02365100	SPRING CREE AT COUNTY RD 55 NEAR GENEVA, ALABAMA	ST	31.04323464	-85.7529886	1	NAD83				03140203
USGS	02365310	GRANTS BRANCH TRIBUTARY NEAR FADETTE AL	ST	31.0393466	-85.58632219	U	NAD83				03140203
USGS	02367400	YELLOW RIVER NR SANFORD, ALA	ST	31.31739106	-86.3557878	U	NAD83				03140103
USGS	02367478	LIGHTWOOD KNOT CREEK ON U.S. HWY 331 NR OPP, ALA	ST	31.32711205	-86.2652298	U	NAD83				03140103
USGS	02367480	LIGHTWOOD KNOT CREEK NEAR OPP AL	ST	31.294613	-86.282452	U	NAD83				03140103
USGS	02367495	POLEY CREEK NR SANFORD, ALA	ST	31.3262791	-86.3002308	U	NAD83				03140103
USGS	02367500	LIGHTWOOD KNOT CREEK AT BABBIE AL	ST	31.2707251	-86.3135636	U	NAD83	 185.00	.01	NGVD29	03140103
USGS	02367515	YELLOW RIVER NR BABBIE, ALA	ST	31.23850425	-86.3399525	U	NAD83				03140103
USGS	02367600	INDIAN CREEK NEAR OPP, AL.	ST	31.254614	-86.288007	U	NAD83				03140103
USGS	02367615	INDIAN CREEK NR OPP, ALA	ST	31.2257267	-86.3221739	U	NAD83				03140103
USGS	02367620	INDIAN CREEK BELOW OPP, ALA	ST	31.21294969	-86.3402296	U	NAD83				03140103
USGS	02367640	YELLOW RIVER NR FLORALA, ALA	ST	31.0948993	-86.4357846	U	NAD83				03140103
USGS	02367698	FIVE RUNS CREEK AT ST. HWY 55 NR ANDALUSIA, ALA	ST	31.2229508	-86.4538439	U	NAD83				03140103
USGS	02367699	BAY BRANCH NR ANDALUSIA, ALA	ST	31.25572814	-86.49662359	U	NAD83				03140103
USGS	02367700	FIVE RUNS CREEK NEAR ANDALUSIA AL	ST	31.26683798	-86.4332889	U	NAD83				03140103
USGS	02367800	YELLOW RIVER NEAR WING AL	ST	31.01018008	-86.537174	U	NAD83	 96.13	.01	NGVD29	03140103
USGS	02368690	POND CREEK NR FLORALA, ALA	ST	30.98740285	-86.3493911	U	NAD83				03140103
USGS	02368705	POND CREEK BELOW FLORALA, ALA	ST	30.96740353	-86.3671694	U	NAD83				03140103
USGS	02369725	BLACKWATER CREEK NEAR FALCO AL	ST	31.0418459	-86.658289	U	NAD83				03140104
USGS	02369738	BLACKWATER CREEK AT BRADLEY AL	ST	31.02934644	-86.7027343	U	NAD83				03140104
USGS	02369755	PANTHER CREEK NEAR FALCO AL	ST	31.07240035	-86.69023499	U	NAD83				03140104
USGS	02369764	PANTHER CREEK AT BRADLEY AL	ST	31.03490179	-86.7055123	U	NAD83				03140104
USGS	02369775	BEAR CREEK NEAR DIXIE AL	ST	31.09739938	-86.7207919	U	NAD83				03140104
USGS	02369798	BEAR CREEK AT BRADLEY AL	ST	31.0349018	-86.7124569	U	NAD83				03140104
USGS	02369800	BLACKWATER RIVER NEAR BRADLEY AL	ST	31.02767985	-86.7099567	S	NAD83	 121.87	 .1	NGVD29	03140104
USGS	02370800	CONECUH RIVER AT BOSWELL AL	ST	31.97265456	-85.784393	U	NAD83				03140301
USGS	02370900	CONECUH RIVER NEAR CORCORAN AL	ST	31.86876667	-85.9466179	U	NAD83				03140301
USGS	02371000	CONECUH RIVER NEAR TROY AL	ST	31.8445999	-85.99467429	U	NAD83	 313.30	.01	NGVD29	03140301
USGS	02371050	TRIBUTARY TO CONECUH RIVER NEAR TROY	ST	31.8146007	-85.9866181	S	NAD83	 380	 10	NGVD29	03140301
USGS	02371160	DOUBLE BRANCH NR TROY, ALA	ST	31.79432294	-86.0266192	U	NAD83				03140301
USGS	02371200	INDIAN CREEK NEAR TROY AL	ST	31.81404388	-86.1207899	U	NAD83	 354.00	.01	NGVD29	03140301
USGS	02371300	CONECUH RIVER AT GOSHEN AL	ST	31.71960196	-86.1099545	U	NAD83				03140301
USGS	02371380	CONECUH RIVER AT GLENWOOD AL	ST	31.6598812	-86.1588438	U	NAD83				03140301
USGS	02371470	SANDY CREEK NEAR BRANTLEY, AL.	ST	31.5948829	-86.22078879	U	NAD83				03140301
USGS	02371500	CONECUH RIVER AT BRANTLEY AL	ST	31.57349458	-86.2516226	S	NAD83	 226.20	.01	NGVD29	03140301
USGS	02371503	DRY CREEK NEAR LUVERNE, ALABAMA	ST	31.6204375	-86.2707913	S	NAD83				03140301
USGS	02371505	DRY CREEK AT BRANTLEY AL	ST	31.5812721	-86.2713458	U	NAD83				03140301
USGS	02371600	CONECUH RIVER AT DOZIER,AL.	ST	31.48766415	-86.3610691	U	NAD83				03140301
USGS	02371628	SIMS MILL CREEK NR GANTT, ALA	ST	31.4737758	-86.4194044	U	NAD83				03140301
USGS	02371630	BIG CREEK NEAR GANTT AL	ST	31.4651649	-86.4069037	U	NAD83				03140301
USGS	02371680	FEAGIN CREEK NEAR GANTT AL	ST	31.41905537	-86.433848	U	NAD83				03140301
USGS	02371698	CONECUH RI AT MCWILLIAMS STEAMPLANT (WITHDRAW)	ST	31.40461168	-86.4794048	U	NAD83				03140301
USGS	02371701	CONECUH RIVER BEL GANTT DAM NR ANDALUSIA, AL.	ST	31.39961186	-86.4807936	U	NAD83				03140301
USGS	02371702	CONECUH RIVER AT MCWILLIAMS STEAM PLANT (RELEASE)	ST	31.4026673	-86.4794048	U	NAD83				03140301
USGS	02371800	OLUSTEE CREEK NR PINE LEVEL, ALA	ST	32.00237338	-86.0599567	U	NAD83				03140302
USGS	02371825	OLUSTEE CREEK ABOVE SHADY GROVE, ALA	ST	31.9440408	-86.1188471	U	NAD83				03140301
USGS	02371840	OLUSTEE CREEK AT SHADY GROVE, ALA	ST	31.90404147	-86.1482922	U	NAD83				03140301
USGS	02371850	PATSALIGA CREEK NEAR PETREY AL	ST	31.83182067	-86.1830148	U	NAD83				03140302
USGS	02371950	PATSALIGA CREEK AT PATSBURG AL	ST	31.77237733	-86.2238488	U	NAD83				03140302
USGS	02371975	PATSALIGA CREEK NEAR LUVERNE AL	ST	31.75015545	-86.2582943	U	NAD83				03140302
USGS	02372000	PATSALIGA CREEK AT LUVERNE AL	ST	31.72432298	-86.2782944	U	NAD83	 267.53	.01	NGVD29	03140302
USGS	02372100	LITTLE PATSALIGA CREEK NEAR HONORAVILLE AL	ST	31.86681904	-86.3666331	U	NAD83				03140302
USGS	02372150	LITTLE PATSALIGA CREEK NEAR RUTLEDGE AL	ST	33.72871145	-86.3299797	U	NAD83				03140302
USGS	02372250	PATSALIGA CREEK NEAR BRANTLEY AL	ST	31.59627177	-86.40551809	U	NAD83	 220.00	.01	NGVD29	03140302
USGS	02372300	PATSALIGA CREEK NEAR BOSTON AL	ST	31.5146079	-86.5060753	U	NAD83				03140302
USGS	02372350	PATSALIGA CREEK NEAR GANTT, AL.	ST	31.41488906	-86.5346844	U	NAD83				03140302
USGS	02372380	PATSALIGA CREEK AT CO RD 59 NR RIVER FALLS, AL.	ST	31.3704462	-86.5235718	U	NAD83				03140302
USGS	02372400	BUCK CREEK NEAR RED LEVEL AL	ST	31.4168332	-86.5832968	U	NAD83				03140302
USGS	02372422	CONECUH RIVER BEL PT A DAM NR RIVER FALLS, AL.	ST	31.3612799	-86.5196826	S	NAD83	 120.80	.01	NGVD29	03140301
USGS	02372430	CONECUH RIVER AT RIVER FALLS, ALABAMA	ST	31.34822474	-86.5294047	S	NAD83	 120.80	 .1	NGVD29	03140301
USGS	02372435	PRESTWOOD CREEK NR RIVER FALLS, ALA	ST	31.33822514	-86.5219042	U	NAD83				03140301
USGS	02372475	CONECUH RIVER AT CO RO 42 NEAR ANDALUSIA	ST	31.27767138	-86.5691259	S	NAD83				03140301
USGS	02372500	CONECUH RIVER NEAR ANDALUSIA AL	ST	31.25544969	-86.6002372	U	NAD83	 106.77	.01	NGVD29	03140301
USGS	02372510	CATOE CREEK NEAR ANDALUSIA AL	ST	31.16517496	-86.6055129	U	NAD83	 192.00	.01	NGVD29	03140301
USGS	02372550	CONECUH RIVER AT HART BRIDGE NR FAIRFIELD	ST	31.19600685	-86.6807932	S	NAD83				03140301
USGS	02372690	LONG CREEK NEAR GARLAND AL	ST	31.58904927	-86.8666416	U	NAD83				03140303
USGS	02372700	SEPULGA RIVER NEAR GARLAND AL	ST	31.5518283	-86.8669184	U	NAD83				03140303
USGS	02372740	PERSIMMON CREEK NEAR GREENVILLE AL	ST	31.83265278	-86.6021958	U	NAD83				03140303
USGS	02372745	TANYARD BRANCH AT GREENVILLE, ALA	ST	31.8337638	-86.6155294	U	NAD83				03140303
USGS	02372750	UNNAMED BRANCH NEAR GREENVILLE, ALA	ST	31.7954316	-86.6021954	U	NAD83				03140303
USGS	02372755	TRIB TO PERSIMMON CREEK AT GREENVILLE	ST	31.82126409	-86.6338631	S	NAD83	 380	 10	NGVD29	03140303
USGS	02372800	STALLINGS CREEK NEAR GREENVILLE AL	ST	31.77682087	-86.6458073	U	NAD83				03140303
USGS	02372830	PERSIMMON C NR CHAPMAN, ALA	ST	31.69043488	-86.619416	U	NAD83				03140303
USGS	02372860	ROCKY CREEK AT CHAPMAN AL	ST	31.6851569	-86.711918	U	NAD83				03140303
USGS	02372863	ROCKY C NR GEORGIANA, ALA	ST	31.6440472	-86.7099725	U	NAD83				03140303
USGS	02372865	UNNAMED BRANCH NR GEORGIANA, ALA	ST	31.62849216	-86.71525	U	NAD83				03140303
