agency_cd	site_no	station_nm	site_tp_cd	dec_lat_va	dec_long_va	coord_acy_cd	dec_coord_datum_cd	alt_va	alt_acy_va	alt_datum_cd	huc_cd
USGS	03573205	SHORT CREEK - ALBERTVILLE,ALA	ST	34.35786898	-86.20942389	U	NAD83				06030001
USGS	03573430	BIG SPRING CREEK NEAR BROOKSVILLE, AL.	ST	34.20426205	-86.4233189	U	NAD83				06030001
USGS	03573450	BIG SPRING CREEK NEAR GUNTERSVILLE AL	ST	34.2770385	-86.363039	U	NAD83				06030001
USGS	03573460	BIG SPRING CREEK NEAR SIDNEY AL	ST	34.29203816	-86.358039	U	NAD83				06030001
USGS	03573465	GUNTERSVILLE WATER SUPPLY#1-BIG SPRING CREEK	ST	34.34925856	-86.2944262	U	NAD83				06030001
USGS	03573500	TENNESSEE RIVER AT GUNTERSVILLE AL	ST	34.3731468	-86.2894264	U	NAD83	 546.31	.01	NGVD29	06030001
USGS	03573600	BROWNS CREEK NEAR RED HILL AL	ST	34.26592784	-86.4038739	U	NAD83				06030001
USGS	03573610	BROWNS CREEK NEAR DIAMOND AL	ST	34.28398294	-86.38804	U	NAD83				06030001
USGS	03573615	BROWNS CREEK (GUNTERSVILLE WATER SYSTEM)	ST	34.33398144	-86.329705	U	NAD83				06030001
USGS	03573617	BROWNS CREEK AT HWY 69 BRIDGE	ST	34.357592	-86.3302608	U	NAD83				06030001
USGS	03573900	GRANT FILTRATION PLANT	ST	34.4609221	-86.2749827	U	NAD83				06030001
USGS	03574035	SHOAL CREEK AT NEIGHBORS MILL, ALA	ST	34.38925887	-86.4249863	U	NAD83				06030001
USGS	03574100	ESTILL FORK AT ESTILLFORK AL	ST	34.91	-86.1683333	U	NAD83				06030002
USGS	03574150	HURRICANE CREEK NR ESTILLFORK, ALA	ST	34.9086969	-86.1527617	U	NAD83				06030002
USGS	03574190	FOWLER COVE BRANCH NEAR SWAIM, AL.	ST	34.85647519	-86.1952621	U	NAD83				06030001
USGS	03574200	LARKIN FORK AT SWAIM AL	ST	34.86564206	-86.208318	U	NAD83				06030002
USGS	03574220	LICK FORK AT PRINCETON AL	ST	34.84508688	-86.2366517	U	NAD83				06030002
USGS	03574230	PAINT ROCK RIVER NEAR PRINCETON AL	ST	34.82786474	-86.2433184	U	NAD83				06030002
USGS	03574232	WILLIAMS COVE BRANCH NEAR HOLLYTREE, AL.	ST	34.80425345	-86.2324846	U	NAD83				06030002
USGS	03574240	DRY CREEK AT HOLLYTREE AL	ST	34.79230929	-86.2524849	U	NAD83				06030002
USGS	03574242	DRY CREEK BL STATE HWY 65 NR HOLLYTREE, ALA	ST	34.78953149	-86.2508182	U	NAD83				06030002
USGS	03574250	FRAZIER COVE BRANCH NEAR LITTLE NASHVILLE, AL.	ST	34.75647564	-86.23359539	U	NAD83				06030002
USGS	03574275	MILL CREEK NEAR BAILEYTOWN, AL.	ST	34.85369624	-86.1138717	U	NAD83				06030002
USGS	03574290	POLE BRANCH NEAR SKYLINE, AL.	ST	34.80480736	-86.1230381	U	NAD83				06030002
USGS	03574294	GUESS CREEK NR LATHAM CEMETERY NR LITTLE NASHVILLE	ST	34.7678636	-86.1744277	U	NAD83				06030002
USGS	03574300	GUESS CREEK NEAR TRENTON AL	ST	34.76203038	-86.1808167	U	NAD83				06030002
USGS	03574310	GUESS CREEK AT GUESS CREEK CHURCH, ALA	ST	34.7586972	-86.1927613	U	NAD83				06030002
USGS	03574320	HUNTER HOLLOW BRANCH ABOVE LITTLE NASHVILLE, AL.	ST	34.78314175	-86.1955393	U	NAD83				06030002
USGS	03574325	HUNTER HOLLOW BRANCH NEAR LITTLE NASHVILLE, AL.	ST	34.75953075	-86.2049838	U	NAD83				06030002
USGS	03574405	LITTLE DRY CREEK NEAR GARTH AL	ST	34.74258816	-86.3224859	U	NAD83				06030002
USGS	03574410	CLEAR CREEK AT GARTH AL	ST	34.72786578	-86.3108189	U	NAD83				06030002
USGS	03574430	SHANTY BRANCH AT GURLEY, ALA	ST	34.70092217	-86.3616531	U	NAD83				06030002
USGS	03574440	COLE SPRING BRANCH NEAR PAINT ROCK AL	ST	34.6831439	-86.3299857	U	NAD83				06030002
USGS	03574500	PAINT ROCK RIVER NEAR WOODVILLE AL	ST	34.6242547	-86.3063737	U	NAD83	 570.95	.01	NGVD29	06030002
USGS	03574550	LITTLE PAINT CREEK NEAR WOODVILLE, AL	ST	34.60480985	-86.276373	S	NAD83	 580	 10	NGVD29	06030002
USGS	03574560	PAINT ROCK RIVER AT BUTLER MILL NEAR WOODVILLE	ST	34.57981027	-86.3013733	U	NAD83				06030002
USGS	03574580	TREMBLE CREEK NEAR NEW HOPE AL	ST	34.57703316	-86.3444298	U	NAD83				06030002
USGS	03574600	PAINT ROCK RIVER NEAR NEW HOPE AL	ST	34.51258874	-86.3402627	U	NAD83				06030002
USGS	03574615	CEDAR CREEK NR NEW HOPE, ALA	ST	34.52897775	-86.3499852	U	NAD83				06030002
USGS	03574634	POND CREEK NR NEW HOPE, ALA	ST	34.53231149	-86.37665249	U	NAD83				06030002
USGS	03574640	PAINT ROCK RIVER NR NEW HOPE, ALA	ST	34.5178672	-86.3855415	U	NAD83				06030002
USGS	03574650	THE BAYOU NR NEW HOPE, ALA	ST	34.52314535	-86.4102643	U	NAD83				06030002
USGS	03574672	LITTLE PAINT ROCK CREEK NR GUNTERSVILLE, ALA	ST	34.4723121	-86.3752632	U	NAD83				06030001
USGS	03574673	LITTLE PAINT ROCK CREEK AT HEBRON, AL.	ST	34.4845342	-86.3863747	U	NAD83				06030002
USGS	03574675	SCOTT BRANCH NR HEBRON, ALA	ST	34.4967566	-86.413042	U	NAD83				06030002
USGS	03574680	TENNESSEE RIVER NEAR MORGAN CITY, AL	ST	34.49314698	-86.51776699	H	NAD83				06030002
USGS	03574709	FLINT RIVER ABOVE STEWART BRANCH NEAR FISK AL	ST	34.98897636	-86.5255488	U	NAD83				06030002
USGS	03574710	STEWART BRANCH NEAR HAZEL GREEN AL	ST	34.98536536	-86.5180486	U	NAD83				06030002
USGS	03574715	SLATE ROCK BRANCH NEAR HAZEL GREEN AL	ST	34.9834207	-86.5438826	U	NAD83				06030002
USGS	03574740	FLINT RIVER NEAR FISK AL	ST	34.96147655	-86.5519381	U	NAD83				06030002
USGS	03574743	WALKER CREEK NEAR HAZEL GREEN AL	ST	34.97619837	-86.5733278	U	NAD83				06030002
USGS	03574747	FOWLER CREEK NEAR HAZEL GREEN AL	ST	34.9767538	-86.5849948	U	NAD83				06030002
USGS	03574750	WEST FORK FLINT RIVER NEAR HAZEL GREEN, AL	ST	34.95814314	-86.5691608	S	NAD83	 750	  5	NGVD29	06030002
USGS	03574755	PIGRUM BRANCH NEAR HAZEL GREEN AL	ST	34.9392549	-86.5199925	U	NAD83				06030002
USGS	03574768	FLINT R AT OSCAR PATTERSON ROAD NR HAZEL GREEN, AL	ST	34.88064458	-86.48054629	S	NAD83				06030002
USGS	03574770	FLINT RIVER NEAR NEW MARKET AL	ST	34.8789779	-86.4805463	U	NAD83				06030002
USGS	03574773	MOUNTAIN FK BL ROCK FORD BR NR MT. FK CHURCH, AL	ST	34.9595319	-86.335266	H	NAD83				06030002
USGS	03574775	MOUNTAIN FK BL DRY CR NR MT. FK CHURCH, AL	ST	34.9506432	-86.3655444	H	NAD83				06030002
USGS	03574784	MOUNTAIN FORK ABV HARRIS SPG NR NEW MARKET, ALA	ST	34.9300879	-86.391656	U	NAD83				06030002
USGS	03574786	MOUNTAIN FORK ABV WATERCRESSPG NR NEW MARKET, AL	ST	34.92758794	-86.3936004	U	NAD83				06030002
USGS	0357478720	WATERCRESS POND CANAL NR NEW MARKET, ALA	ST-CA	34.92647685	-86.3947115	U	NAD83				06030002
USGS	03574788	MOUNTAIN FORK BL WATERCRESS SPG NR NEW MARKET, A	ST	34.9248102	-86.3958227	U	NAD83				06030002
USGS	03574789	MOUNTAIN FORK BL WATERCRESS POND NR NEW MARKET, AL	ST	34.920088	-86.3986004	H	NAD83				06030002
USGS	03574790	MOUNTAIN FORK AT MOUNTAIN FORK RD, NEW MARKET AL	ST	34.91786584	-86.4013783	U	NAD83				06030002
USGS	03574792	UNNAMED TRIB TO MOUNTAIN FK AT NEW MARKET, AL	ST	34.91758819	-86.4208232	H	NAD83				06030002
USGS	03574794	MT. FORK CREEK AT NEW MARKET, AL	ST	34.91092168	-86.4366568	S	NAD83	 710	  5	NGVD29	06030002
USGS	0357479450	MILNER POND NR PLEVNA	ST	34.9792542	-86.393601	U	NAD83				06030002
USGS	0357479455	JENNY RIVER AT ROSEBORO, AL	ST	34.9884208	-86.3997123	H	NAD83				06030002
USGS	0357479465	PRATER SP TRIB AT HWY 121 NR ROSEBORO, AL	ST	34.9828653	-86.4047124	S	NAD83				06030002
USGS	0357479470	JENNY RV @ STEELE LN AT ROSEBORO, AL	ST	34.98703197	-86.4105459	H	NAD83				06030002
USGS	0357479480	JENNY RIVER NR PLEVNA, AL	ST	34.9848098	-86.423324	H	NAD83				06030002
USGS	03574795	HESTER CR NR PLEVNA, AL	ST	34.97786549	-86.4516579	H	NAD83				06030002
USGS	0357479540	UNNAMED TRIB TO HESTER CREEK AT FAIRVIEW, AL	ST	34.9745322	-86.45471349	H	NAD83				06030002
USGS	0357479550	HESTER CREEK BELOW PHILLIPS RD NR FAIRVIEW	ST	34.97286556	-86.4541579	H	NAD83				06030002
USGS	03574796	WALKER BRANCH NEAR PLEVNA AL	ST	34.9653656	-86.4458243	U	NAD83				06030002
USGS	0357479650	HESTER CREEK AT BUDDY WILLIAMSON RD NR PLEVNA, AL	ST	34.96092128	-86.4636024	S	NAD83	 756.34	.01	NGVD29	06030002
USGS	0357479680	SWAMP BR AT BUDDY WILLIAMS RD NR MINT SPRING, AL	ST	34.9614769	-86.488603	H	NAD83				06030002
USGS	0357479690	SWAMP BRANCH AT MINT SPRING RD NR MINT SPRING, AL	ST	34.9539769	-86.4686025	H	NAD83				06030002
USGS	03574799	HESTER CREEK NEAR NEW MARKET, AL	ST	34.91036614	-86.4374901	H	NAD83				06030002
USGS	03574800	MOUNTAIN FORK BL HESTER CREEK NR NEW MARKET AL	ST	34.91036614	-86.4383235	U	NAD83				06030002
USGS	03574802	MOUNTAIN FORK NEAR NEW MARKET AL	ST	34.87564458	-86.4741572	U	NAD83				06030002
USGS	03574804	BRIER FORK FLINT RIVER NR HAZEL GREEN, ALA	ST	34.97730866	-86.670275	U	NAD83				06030002
USGS	03574806	BRIER F FLINT R AB HUCKLEBERRY BR NR HAZEL GREEN	ST	34.97730866	-86.670275	U	NAD83				06030002
USGS	03574808	HUCKLEBERRY BRANCH NR HAZEL GREEN, ALA	ST	34.9725866	-86.6597192	U	NAD83				06030002
USGS	03574810	BRIER FORK NR HAZEL GREEN, ALA	ST	34.9620312	-86.6647192	U	NAD83				06030002
USGS	03574815	BRIER FORK NEAR HAZEL GREEN AL	ST	34.9195323	-86.621662	U	NAD83				06030002
USGS	03574816	BANYON SWAMP CREEK NR HAZEL GREEN, ALA	ST	34.9064769	-86.6338845	U	NAD83				06030002
USGS	03574817	COPELAND C AT ELKWOOD SECTION RD NR HAZEL GREEN	ST	34.9770312	-86.6302739	U	NAD83				06030002
USGS	03574820	COPELAND CREEK NEAR HAZEL GREEN AL	ST	34.9248101	-86.6041616	U	NAD83				06030002
USGS	03574823	BRIER FORK NEAR HAZEL GREEN, AL	ST	34.9023106	-86.5841607	S	NAD83	 740	  5	NGVD29	06030002
USGS	03574825	BRIER FORK @US 231 NR MERIDIANVILLE, ALABAMA	ST	34.8759222	-86.5705489	U	NAD83				06030002
USGS	03574835	BRIER FORK AB BEAVERDAM C NR MERIDIANVILLE AL	ST	34.8534227	-86.5430478	U	NAD83				06030002
USGS	03574838	BEAVERDAM CREEK NR TONEY, ALA	ST	34.9034211	-86.68916399	U	NAD83				06030002
USGS	03574840	MORRIS BRANCH NEAR TONEY AL	ST	34.89925446	-86.6986087	U	NAD83				06030002
USGS	03574845	UNNAMED TRIB TO BEAVERDAM CREEK NR TONEY, ALA	ST	34.88008825	-86.6847193	U	NAD83				06030002
USGS	03574850	DYAS SWAMP TRIB TO BEAVERDAM C NR TONEY, ALA	ST	34.86786638	-86.661385	U	NAD83				06030002
USGS	03574855	BEAVERDAM C AT PULASKI PIKE NR MERIDIANVILLE AL	ST	34.86119855	-86.892782	U	NAD83				06030002
USGS	03574870	BEAVERDAM CREEK NEAR MERIDIANVILLE, AL	ST	34.83814506	-86.5713819	S	NAD83	 705	  5	NGVD29	06030002
USGS	03574872	STRAIGHT DITCH AT HUNTSVILLE AL	ST-DCH	34.82342319	-86.535825	U	NAD83				06030002
USGS	03574970	BRIER FORK NEAR MERIDIANVILLE AL	ST	34.85314494	-86.5430478	U	NAD83				06030002
USGS	03574998	BRIER FORK NEAR CHASE AL	ST	34.8234231	-86.4847123	U	NAD83				06030002
USGS	03575000	FLINT RIVER NEAR CHASE AL	ST	34.82286756	-86.4830456	U	NAD83	 640.37	.01	NGVD29	06030002
USGS	03575020	FLINT RIVER NEAR CEDAR GAP AL	ST	34.78759025	-86.4847119	U	NAD83				06030002
USGS	03575028	CHASE CREEK NEAR CHASE AL	ST	34.78509035	-86.489712	U	NAD83				06030002
USGS	03575034	UNNAMED TRIB TO CHASE CREEK NR CHASE, ALA	ST	34.7870348	-86.4924898	U	NAD83				06030002
USGS	03575035	CHASE CREEK NEAR RYLAND AL	ST	34.78731248	-86.4847119	U	NAD83				06030002
USGS	03575040	FLINT RIVER NEAR MOUNT CARMEL AL	ST	34.78703465	-86.4808229	U	NAD83				06030002
USGS	03575046	FLINT RIVER NR MAYSVILLE, ALA	ST	34.76758988	-86.4424886	S	NAD83				06030002
USGS	03575100	FLINT RIVER AT BROWNSBORO, AL.	ST	34.7492568	-86.4466551	S	NAD83	 615.92	.01	NGVD29	06030002
USGS	03575112	HAMBRICK BRANCH AT BROWNSBORO, ALA	ST	34.74786807	-86.4566553	U	NAD83				06030002
USGS	03575120	FLINT RIVER WEST OF GURLEY AL	ST	34.69647869	-86.4222099	U	NAD83				06030002
USGS	03575125	POTTS HOLLOW TRIB TO FLINT R NR GURLEY, ALA	ST	34.6967566	-86.4316546	U	NAD83				06030002
USGS	03575140	HURRICANE CREEK NEAR NEW MARKET AL	ST	34.87897715	-86.3872109	U	NAD83				06030002
USGS	03575150	HURRICANE CREEK AB MOLDER BRANCH NR MAYSVILLE AL	ST	34.80203346	-86.40332149	U	NAD83				06030002
USGS	03575153	MOULDER BRANCH NR MAYSVILLE, ALA	ST	34.79786646	-86.37554309	U	NAD83				06030002
USGS	03575155	UNNAMED TRIB TO HURRICANE C NR MAYSVILLE, ALA	ST	34.7909225	-86.40971039	U	NAD83				06030002
USGS	03575157	HURRICANE CREEK NEAR MAYSVILLE AL	ST	34.755367	-86.3922097	U	NAD83				06030002
USGS	03575185	KILLINGSWORTH COVE BRANCH NR GURLEY, ALA	ST	34.74370006	-86.3719314	U	NAD83				06030002
USGS	03575200	HURRICANE CREEK NEAR GURLEY, AL	ST	34.70925609	-86.3997095	S	NAD83	 610	 10	NGVD29	06030002
USGS	03575210	HURRICANE CREEK WEST OF GURLEY AL	ST	34.69814524	-86.4152653	U	NAD83				06030002
USGS	03575220	FLINT RIVER BL HURRICANE C NR GURLEY, ALA	ST	34.68231216	-86.4299878	U	NAD83				06030002
USGS	03575230	FLINT RIVER BL GRAYSON SPG NR GURLEY, ALA	ST	34.6795343	-86.425821	U	NAD83				06030002
USGS	03575235	FLINT RIVER AT ADAIR FORD NR GURLEY, ALA	ST	34.6709233	-86.4310989	U	NAD83				06030002
USGS	03575245	FLINT RIVER ABV OLD U.S. HWY 431 NR GURLEY, ALA	ST	34.65592344	-86.4388767	U	NAD83				06030002
USGS	03575250	FLINT RIVER NEAR GURLEY AL	ST	34.70925609	-86.3997095	U	NAD83				06030002
USGS	03575260	GOOSE CREEK NEAR BERKLEY AL	ST	34.6300903	-86.4519324	U	NAD83				06030002
USGS	0357526040	Big Cove Creek at CCC Cistern (13-M) at Huntsville	ST	34.72314656	-86.531935	S	NAD83				06030002
USGS	0357526060	Big Cove Creek (15-L) ab Dug Hill Road nr Huntsvil	ST	34.707591	-86.5152677	S	NAD83				06030002
USGS	0357526120	Unnamed Trib (7-T) to Big Cove Cr at Huntsville, a	ST	34.74120208	-86.5269349	S	NAD83				06030002
USGS	0357526130	Unnamed Trib (8-T) to Big Cove Cr at Huntsville, A	ST	34.74175764	-86.5258237	S	NAD83				06030002
USGS	0357526155	Blue Spring (10-M) at Monte Sano Pk at Huntsville	ST	34.7348132	-86.5208235	S	NAD83				06030002
USGS	0357526160	Unnamed Trib (B-14) to Big Cove Cr at Huntsville,	ST	34.73286877	-86.5222125	U	NAD83				06030002
USGS	0357526170	Unnamed Trib (B-8)to Big Cove Cr nr Huntsville, Al	ST	34.72175767	-86.5113787	U	NAD83				06030002
USGS	0357526180	Unnamed Trib (B-9) to Big Cove Cr nr Huntsville, A	ST	34.722591	-86.5130454	U	NAD83				06030002
USGS	0357526200	BIG COVE CREEK AT DUG HILL ROAD NR HUNTSVILLE, AL.	ST	34.70481325	-86.512212	U	NAD83				06030002
USGS	0357526300	Unnamed Trib (16-L) to Big Cove Cr nr Huntsville,	ST	34.69481326	-86.5133231	S	NAD83				06030002
USGS	03575270	BIG COVE C AT NUNN STORE NR OWENS CROSSROADS, AL	ST	34.65981295	-86.4791554	U	NAD83				06030002
USGS	03575272	PEEVEY CREEK NEAR GURLEY, ALA	ST	34.68203467	-86.44832149	S	NAD83				06030002
USGS	03575275	ROBINSON MILL CREEK NEAR OWENS CROSS ROADS AL	ST	34.66036818	-86.4583216	U	NAD83				06030002
USGS	03575280	FLINT RIVER NEAR BIG COVE AL	ST	34.63814615	-86.4688773	U	NAD83				06030002
USGS	0357529500	UNNAMED TRIB (18M) TO FLINT RIVER NR HUNTSVILLE, A	ST	34.65925775	-86.5138786	S	NAD83				06030002
USGS	03575330	FLINT RIVER AT OWEN CROSS ROADS AL	ST	34.5939795	-86.4683215	U	NAD83				06030002
USGS	03575340	GLOVER COVE CREEK NEAR OWENS CROSS ROADS AL	ST	34.6042564	-86.4135981	U	NAD83	 610.00	.01	NGVD29	06030002
USGS	03575348	GLOVER COVE CREEK AT OWENS CROSSROADS, ALA	ST	34.59259048	-86.4588768	U	NAD83				06030002
USGS	03575350	FLINT RIVER WEST OF OWENS CROSSROADS, ALA	ST	34.58703504	-86.4660992	U	NAD83				06030002
USGS	03575390	YELLOW BANK C NR OWENS CROSSROADS, ALA	ST	34.5489793	-86.4524876	U	NAD83				06030002
USGS	03575400	FLINT RIVER NEAR OWENS CROSSROADS AL	ST	34.53620214	-86.4910995	U	NAD83				06030002
USGS	03575420	FLINT RIVER NEAR HOBBS ISLAND, AL	ST	34.5045358	-86.5244339	H	NAD83				06030002
USGS	03575450	TENNESSEE RIVER NEAR HOBBS ISLAND, AL	ST	34.52953587	-86.544157	H	NAD83				06030002
USGS	03575480	TENNESSEE RIVER AT STATE DOCK NEAR WHITESBURG, AL	ST	34.5684247	-86.5544354	H	NAD83				06030002
USGS	03575490	TENNESSEE RIVER DS HOBBS ISLAND NR WHITESBURG, AL.	ST	34.56842474	-86.5583244	S	NAD83				06030002
USGS	03575500	TENNESSEE RIVER AT WHITESBURG AL	ST	34.57175806	-86.5580466	U	NAD83	 549.00	.01	NGVD29	06030002
USGS	03575501	TENNESSEE RIVER AT WHITESBURG (STAGE ONLY), AL.	ST	34.57175806	-86.5580466	U	NAD83	 549.00	.01	NGVD29	06030002
USGS	03575686	ALDRIDGE CREEK AT DUNSMORE ST AT HUNTSVILLE AL	ST	34.7042577	-86.5524913	S	NAD83				06030002
USGS	0357568650	ALDRIDGE CREEK AT TONEY DRIVE AT HUNTSVILLE, AL.	ST	34.6981466	-86.5505467	U	NAD83				06030002
USGS	03575687	ALDRIDGE C NR JONES VALLEY SCHOOL NR HUNTSVILLE,	ST	34.6956466	-86.5497134	U	NAD83				06030002
USGS	03575688	ALDRIDGE CREEK BELOW HUNTSVILLE, ALA	ST	34.6870355	-86.5486022	U	NAD83				06030002
USGS	0357568810	UNNAMED TRIB (17-T) TO MARTIN HOLLOW AT HUNTSVILLE	ST	34.68009106	-86.5174899	S	NAD83				06030002
USGS	0357568820	MARTIN HOLLOW NEAR HUNTSVILLE, AL.	ST	34.68536886	-86.5452687	U	NAD83				06030002
USGS	0357568840	UNNAMED TRIB TO UNNAMED TRIB TO ALDRIDGE C NR HUNT	ST	34.68675775	-86.5458243	U	NAD83				06030002
USGS	0357568850	ALDRIDGE C BL UNNAMED TRIB BL HUNTSVILLE, ALA	ST	34.68425776	-86.5491577	U	NAD83				06030002
USGS	0357568870	UNNAMED TRIB TO ALDRIDGE NR HUNTSVILLE, ALABAMA	ST	34.67564667	-86.5494355	U	NAD83				06030002
USGS	0357568880	UNNAMED TRIB TO UNNAMED TRIB TO ALDRIDGE C	ST	34.67564667	-86.5486021	U	NAD83				06030002
USGS	0357568890	ALDRIDGE C ABV FOUR MILE POST ROAD NR HUNTSVILLE	ST	34.67481334	-86.5491577	U	NAD83				06030002
USGS	03575689	ALDRIDGE C BL FOUR MILE POST RD NR HUNTSVILLE, A	ST	34.6692578	-86.5522134	U	NAD83				06030002
USGS	0357568930	UNNAMED TRIB TO ALDRIDGE C NR HUNTSVILLE, ALA	ST	34.66870225	-86.5527689	U	NAD83				06030002
USGS	0357568980	ALDRIDGE C AT SHERWOOD DR NR HUNTSVILLE, ALA	ST	34.6642578	-86.5541579	U	NAD83				06030002
USGS	03575690	ALDRIDGE CREEK ABOVE LILY FLAGG, ALA	ST	34.6606467	-86.5547134	U	NAD83				06030002
USGS	0357569030	UNNAMED SPG BRANCH TRIB TO ALDRIDGE C	ST	34.66120227	-86.5541579	U	NAD83				06030002
USGS	0357569080	UNNAMED TRIB TO ALDRIDGE C NR LILY FLAGG	ST	34.6545356	-86.5463798	U	NAD83				06030002
USGS	03575691	ALDRIDGE C ABV WEATHERLY RD NR LILY FLAGG, ALA	ST	34.64648005	-86.5424907	U	NAD83				06030002
USGS	0357569120	UNNAMED TRIB TO ALDRIDGE CREEK NR LILY FLAGG	ST	34.64620228	-86.5424907	U	NAD83				06030002
USGS	0357569180	ALDRIDGE C ABV ESSLINGER SPG BRANCH NR LILY FLAG	ST	34.63898007	-86.5411017	U	NAD83				06030002
USGS	03575693	UNNAMED TRIB TO ESSLINGER SPG BRANCH NR LILY FLA	ST	34.6395356	-86.53999059	U	NAD83				06030002
USGS	0357569350	UNNAMED TRIB TO ESSLINGER SPG BRANCH BL LILY FLA	ST	34.6370356	-86.53971279	U	NAD83				06030002
USGS	03575694	ESSLINGER SPRING BRANCH NR LILY FLAGG, ALA	ST	34.6370356	-86.5408239	U	NAD83				06030002
USGS	03575695	ALDRIDGE C BL ESSLINGER SPG BRANCH NR LILY FLAGG	ST	34.63675785	-86.5411017	U	NAD83				06030002
USGS	03575696	ALDRIDGE NEAR LILY FLAGG AL	ST	34.62898008	-86.5397128	U	NAD83				06030002
USGS	03575697	ALDRIDGE CREEK BELOW LILY FLAGG, ALA	ST	34.6275912	-86.5391572	U	NAD83				06030002
USGS	03575700	ALDRIDGE CREEK NEAR FARLEY AL	ST	34.6239801	-86.54110169	U	NAD83	 575.90	.01	NGVD29	06030002
USGS	03575730	ALDRIDGE CREEK AT FARLEY AL	ST	34.59509129	-86.545824	U	NAD83				06030002
USGS	03575734	ALDRIDGE CREEK NEAR WHITESBURG AL	ST	34.58370247	-86.5561022	U	NAD83				06030002
USGS	03575736	TENNESSEE RIVER AT FARLEY AL	ST	34.5764803	-86.5691582	U	NAD83				06030002
USGS	03575740	TENNESSEE RIVER AT LACEYS SPRINGS AL	ST	34.5767583	-86.618049	U	NAD83				06030002
USGS	03575750	REDSTONE ARSENAL WATER SUPPLY-TENNESSEE RIVER	ST	34.58620297	-86.6819405	U	NAD83				06030002
USGS	03575780	INDIAN CREEK NEAR MONROVIA AL	ST	34.7867567	-86.7124974	U	NAD83				06030002
USGS	03575788	DUPREE BRANCH NEAR HARVEST AL	ST	34.77731247	-86.714164	U	NAD83				06030002
USGS	03575805	DRY CREEK NR HUNTSVILLE, ALA	ST	34.78620124	-86.6819407	U	NAD83				06030002
USGS	03575808	DRY CREEK NEAR MADISON AL	ST	34.75703515	-86.6858296	U	NAD83				06030002
USGS	03575810	INDIAN CREEK AT US HWY 72 NEAR HUNTSVILLE AL	ST	34.7500908	-86.6974966	U	NAD83				06030002
USGS	03575829	UNNAMED TRIB TO INDIAN C NR MADISON, ALA	ST	34.69786896	-86.7069414	U	NAD83				06030002
USGS	03575830	INDIAN CREEK NEAR MADISON AL	ST	34.6973134	-86.6999967	U	NAD83	 601.32	.01	NGVD29	06030002
USGS	03575849	INDIAN CREEK 400 FT AB MARTIN RD NR MADISON AL	ST	34.6462026	-86.6866629	U	NAD83				06030002
USGS	0357584950	WILLIAMS SPRING NR HUNTSVILLE, ALA	ST	34.63953598	-86.6861073	U	NAD83				06030002
USGS	03575850	INDIAN CREEK AT MARTIN RD NEAR HUNTSVILLE AL	ST	34.64536928	-86.6858295	U	NAD83				06030002
USGS	03575851	INDIAN C 700 FT BL MARTIN RD NR HUNTSVILLE AL	ST	34.6437026	-86.6866629	U	NAD83				06030002
USGS	0357586160	Fagan Creek (2-M) at Bluff Line Tr at Huntsville	ST	34.74259096	-86.5399909	S	NAD83				06030002
USGS	0357586172	UNNAMED TRIB(9T) TO FAGAN BR AT HUNTSVILLE	ST	34.73675765	-86.531935	S	NAD83				06030002
USGS	0357586173	Unnamed Trib (6-T) to Fagan Cr at Huntsville, Al.	ST	34.7370354	-86.5327684	S	NAD83				06030002
USGS	0357586175	Unnamed Trib (5-M) to Fagan Cr at Huntsville, Al.	ST	34.73675764	-86.5383242	S	NAD83				06030002
USGS	0357586180	FAGAN CREEK (4-L) NR OWENS DRIVE AT HUNTSVILLE, Al	ST	34.7384243	-86.5499913	S	NAD83				06030002
USGS	0357586550	Unnamed Trib (11-M) to Fagan Cr at Huntsville, Al.	ST	34.7284243	-86.53971309	S	NAD83				06030002
USGS	0357586560	Unnamed Trib (12-L) to Fagan Cr at Huntsville, AL.	ST	34.72647989	-86.5466578	S	NAD83				06030002
USGS	0357586650	FAGAN CREEK AT ADAMS STREET AT HUNTSVILLE, AL.	ST	34.722591	-86.5749921	U	NAD83				06030002
USGS	03575867	FAGAN C AT GALLATIN ST IN HUNTSVILLE, ALA	ST	34.7237021	-86.58304799	U	NAD83				06030002
USGS	03575868	FAGAN CREEK AT HUNTSVILLE AL	ST	34.7248132	-86.58777039	U	NAD83				06030002
USGS	03575870	FAGAN CREEK AT MOUTH IN HUNTSVILLE, ALA	ST	34.72425767	-86.5913816	U	NAD83				06030002
USGS	0357587090	WEST FORK PINHOOK CR AT BLUE SPRS RD AT HUNTSVILLE	ST	34.78842358	-86.5986045	U	NAD83				06030002
USGS	03575871	MIDDLE FORK PINHOOK C AT MEDARIS RD AT HUNTSVILL	ST	34.78759027	-86.5969378	U	NAD83				06030002
USGS	0357587140	EAST FORK PINHOOK CR AT WINCHESTER RD AT HUNTSVIL	ST	34.79286797	-86.5891598	U	NAD83				06030002
USGS	0357587150	EAST FORK PINHOOK C AT MEDARIS RD AT HUNTSVILLE,	ST	34.7873125	-86.5919376	U	NAD83				06030002
USGS	03575872	WEST FORK PINHOOK C AT BLUE SPGS RD AT HUNTSV'LE	ST	34.78842358	-86.5988823	U	NAD83				06030002
USGS	03575873	WEST FORK PINHOOK C AT TIMBERCREST DR AT HUNTSV'	ST	34.77453494	-86.5936042	U	NAD83				06030002
USGS	0357587400	PINHOOK C AT MASTIN LAKE RD AT HUNTSVILLE, ALA	ST	34.77147944	-86.5922153	U	NAD83	 646.21	.01	NAVD88	06030002
USGS	03575875	UNNAMED TRIB TO PINHOOK C AT HUNTSVILLE, ALA	ST	34.76203516	-86.5861038	U	NAD83				06030002
USGS	0357587550	PINHOOK C AT ABINGDON AVE AT HUNTSVILLE, ALA	ST	34.74564648	-86.5908261	U	NAD83				06030002
USGS	03575876	DALLAS BRANCH 600 FT ABV HAYNES AVE AT HUNTSVILL	ST	34.7567575	-86.5552694	U	NAD83				06030002
USGS	03575877	DALLAS BRANCH AT MAYSVILLE RD AT HUNTSVILLE, ALA	ST	34.7464798	-86.5644363	U	NAD83				06030002
USGS	0357587728	DALLAS BRANCH AT COLEMAN ST IN HUNTSVILLE, AL	ST	34.74564649	-86.5741588	U	NAD83	 639.64	.01	NGVD29	06030002
USGS	0357587730	DALLAS BRANCH AT ANDREW JACKSON WAY AT HUNTSVILL	ST	34.74592427	-86.5763811	U	NAD83				06030002
USGS	03575878	DALLAS BRANCH AT HUNTSVILLE AL	ST	34.74231316	-86.5888816	U	NAD83				06030002
USGS	0357587880	PINHOOK C AT TRAYLOR ISLAND AT HUNTSVILLE, ALA	ST	34.7334243	-86.5966596	U	NAD83				06030002
USGS	03575879	PINHOOK C ABV HOLMES AVE AT HUNTSVILLE, ALA	ST	34.73120209	-86.5952707	U	NAD83				06030002
USGS	03575880	FIVE POINTS DITCH AT HUNTSVILLE AL	ST-DCH	34.73842429	-86.583048	U	NAD83				06030002
USGS	03575888	PINHOOK CREEK AT HOLMES AVE AT HUNTSVILLE AL	ST	34.73009098	-86.5944373	U	NAD83				06030002
USGS	03575890	PINHOOK CREEK AT CLINTON AVE. AT HUNTSVILLE, AL.	ST	34.72759099	-86.5933262	U	NAD83	 592.76	.01	NAVD88	06030002
USGS	03575895	HUNTSVILLE SPG BRANCH AT SEARS DR AT HUNTSVILLE,	ST	34.722591	-86.5924928	U	NAD83				06030002
USGS	03575910	PINE HAVEN DITCH AT HUNTSVILLE AL	ST-DCH	34.76759056	-86.6313833	U	NAD83				06030002
USGS	0357591500	BROGLAN BRANCH AT OAKWOOD AVENUE AT HUNTSVILLE, AL	ST	34.7495353	-86.62527179	U	NAD83				06030002
USGS	03575920	DRY CREEK AT GRIZZARD RD AT HUNTSVILLE, ALA	ST	34.76453505	-86.6430503	U	NAD83				06030002
USGS	03575923	DRY CREEK AT HUNTSVILLE, ALA	ST	34.75231306	-86.6369389	U	NAD83				06030002
USGS	03575930	BROGLAN BRANCH AT HOLMES AVE AT HUNTSVILLE AL	ST	34.72925765	-86.60860449	U	NAD83				06030002
USGS	03575932	HIGHWAY RUNOFF INTO BROGLAN BR AT I-565 AT HUNTSVI	ST	34.72703544	-86.6055488	U	NAD83				06030002
USGS	03575933	BROGLAN BRANCH AT CLINTON AVE IN HUNTSVILLE, AL	ST	34.72342434	-86.6016598	U	NAD83	 596.02	.01	NGVD29	06030002
USGS	03575935	BROGLAN BRANCH AT HUNTSVILLE AL	ST	34.71981324	-86.5952707	U	NAD83				06030002
USGS	03575938	HUNTSV'LE SPG BRNCH BL GOVERNORS DR AT HUNTSVILL	ST	34.71453548	-86.5938817	U	NAD83				06030002
USGS	03575940	HUNTSV'LE SPG BRANCH AT DRAKE AVE AT HUNTSVILLE,	ST	34.70536885	-86.594715	U	NAD83				06030002
USGS	03575948	MERRIMAC BRANCH AT HUNTSVILLE, ALA	ST	34.6984244	-86.5963818	U	NAD83				06030002
USGS	03575950	HUNTSVILLE SP BR AT JOHNSON ROAD, HUNTSVILLE AL	ST	34.6900911	-86.5963817	U	NAD83				06030002
USGS	03575953	DRAINAGE DITCH FROM LANDFILL NEAR HUNTSVILLE AL	ST-DCH	34.68342449	-86.5988818	U	NAD83				06030002
USGS	03575955	HUNTSVILLE SP BR AB SEWAGE PLANT, HUNTSVILLE AL	ST	34.67786896	-86.6008263	U	NAD83				06030002
USGS	03575956	HUNTSV'LE SPG BRANCH BL SEWER PLT NR HUNTSVILLE,	ST	34.66842455	-86.60138189	U	NAD83				06030002
USGS	03575960	HUNTSVILLE SP BR AT MARTIN RD NEAR HUNTSVILLE AL	ST	34.6592579	-86.6044375	U	NAD83				06030002
USGS	03575970	BYRD SPRING CREEK AT HUNTSVILLE, ALA	ST	34.64592464	-86.6013818	U	NAD83				06030002
USGS	03575974	MC DONALD C AT TECHNOLODY DR AT HUNTSVILLE, ALA	ST	34.71953547	-86.6486059	U	NAD83				06030002
USGS	03575976	UNNAMED TRIB #1 TO MCDONALD C AT HUNTSVILLE, ALA	ST	34.71397995	-86.6547173	U	NAD83				06030002
USGS	03575979	HUNTSVILLE RESERVE CENTER RUNOFF AT HUNTSVILLE, AL	ST	34.71453549	-86.627494	U	NAD83				06030002
USGS	03575980	MCDONALD CREEK AT PATTON ROAD NR HUNTSVILLE AL	ST	34.69259115	-86.627494	U	NAD83	 579.50	.01	NAVD88	06030002
USGS	03575983	MC DONNELL C ABV CENTAUR BLVD AT HUNTSVILLE, ALA	ST	34.68981338	-86.6230494	U	NAD83				06030002
USGS	03575987	MC DONNELL C AT HANSEN RD NR HUNTSVILLE, ALA	ST	34.67814676	-86.6191604	U	NAD83				06030002
USGS	03575992	MCDONNELL C BL SEWAGE PLANT #4 NR HUNTSVILLE AL	ST	34.66648014	-86.6172158	U	NAD83				06030002
USGS	03575994	MCDONNELL CREEK AT MARTIN RD AT HUNTSVILLE AL	ST	34.6534246	-86.6127712	U	NAD83				06030002
